{"$id":"https://in-the-loop.local/schemas/kg-rag/kg-rag-harness-boot-receipt.schema.json","$schema":"https://json-schema.org/draft/2020-12/schema","additionalProperties":false,"properties":{"blockers":{"items":{},"type":"array"},"blueprint_id":{"type":"string"},"capabilities":{"items":{"type":"string"},"type":"array"},"digests":{"additionalProperties":false,"properties":{"blueprint":{"type":"string"},"framework_manifest":{"type":"string"},"ontology":{"type":"string"},"qualification":{"type":"string"},"recipe_registry":{"type":"string"},"shapes":{"type":"string"},"source_ledger":{"type":"string"}},"required":["blueprint","framework_manifest","source_ledger","recipe_registry","qualification","ontology","shapes"],"type":"object"},"planes":{"additionalProperties":false,"properties":{"corpus":{"additionalProperties":false,"properties":{"reason_codes":{"items":{"type":"string"},"type":"array"},"status":{"type":"string"}},"required":["status","reason_codes"],"type":"object"},"evaluation":{"additionalProperties":false,"properties":{"reason_codes":{"items":{"type":"string"},"type":"array"},"status":{"type":"string"}},"required":["status","reason_codes"],"type":"object"},"governance_session":{"additionalProperties":false,"properties":{"reason_codes":{"items":{"type":"string"},"type":"array"},"status":{"type":"string"}},"required":["status","reason_codes"],"type":"object"},"retrieval":{"additionalProperties":false,"properties":{"reason_codes":{"items":{"type":"string"},"type":"array"},"status":{"type":"string"}},"required":["status","reason_codes"],"type":"object"}},"required":["governance_session","corpus","retrieval","evaluation"],"type":"object"},"qualification_scope":{"type":"string"},"runtime_readiness_qualified":{"type":"boolean"},"schema":{"type":"string"},"status":{"type":"string"},"warnings":{"items":{},"type":"array"}},"required":["schema","qualification_scope","blueprint_id","status","planes","digests","capabilities","warnings","blockers","runtime_readiness_qualified"],"title":"kg-rag-harness-boot-receipt","type":"object"}
