{"blockers":["blocked_pending_authoritative_brief"],"blueprint_id":"call-e","capabilities":["canonical-json-graph","canonical-jsonl-vector","offline-validation","lexical-baseline","source-ledger","ontology-shapes","entity-relation-extraction","entity-resolution","graph-construction","vector-indexing","query-classification","bounded-graph-traversal","community-global-retrieval","hybrid-fusion","reranking","evidence-packet-assembly","cited-answering","contradiction-handling","abstention","update-deletion-reindexing","adversarial-evaluation","cost-observability"],"digests":{"blueprint":"d674edead5453290f27cd448b702a8d32921558a271f59b15e0adecee4bab9ac","framework_manifest":"5b83f18e50d04b7f09f18af6b454babbad3c0647b7bd84ed4d25af52f4f6a2b9","ontology":"f06c147bf64d7bd8eb329aa43d37186f13bb8c1e59ecba661527c85cde00bb9e","qualification":"3c3bdcce7d8c30adf454f96ed9548177e272ff039bead7bbce48315d47f5c492","recipe_registry":"eec6c909651b6011ac78b594d36fce03044607667274436d2fcde280a900e223","shapes":"d6eb479ef980c44703deeabea99221dfb7fc399073fdc56baecb2050f20380d0","source_ledger":"fe5c49abd49a4dc49312d0c11349d5f8cbb7667c6d55585cc0ec982c8cf19a73"},"planes":{"corpus":{"reason_codes":["blocked_pending_authoritative_brief"],"status":"blocked"},"evaluation":{"reason_codes":["blocked_pending_authoritative_brief"],"status":"blocked"},"governance_session":{"reason_codes":["blocked_pending_authoritative_brief"],"status":"blocked"},"retrieval":{"reason_codes":["blocked_pending_authoritative_brief"],"status":"blocked"}},"qualification_scope":"blueprint","runtime_readiness_qualified":false,"schema":"kg-rag-harness-boot-receipt/1.0","status":"blocked","warnings":[]}
